{
  "enabled": true,
  "product": "u-chat-android",
  "channel": "stable",
  "version": "1.2.0",
  "build": 4,
  "min_supported_build": 1,
  "download_url": "https://github.com/chiperdm/u-chat-ota/releases/download/U-Chat/uchat_v1.2.0_arm64.apk",
  "sha256": "f897df455285ef265c834263b1b3aa417e0abf3edf8bb48cf58ab228fb6f7337",
  "release_notes": [
    "Добавлены юзернеймы и ссылки-приглашения.",
    "Добавлены реакции, ответы и пересылка сообщений.",
    "Улучшена синхронизация и стабильность.",
    "Обновлён интерфейс авторизации.",
    "Добавлены Liquid Glass и Frosted Glass.",
    "Добавлен Dynamic Island Dock.",
    "Добавлена кастомизация интерфейса и обоев.",
    "Добавлена поддержка нескольких аккаунтов.",
    "Оптимизирован APK и исправлены ошибки."
  ],
  "published_at": "2026-10-04T09:59:00Z"
}
